Found Nuvoton WPCM450 (id=0x1a11, rev=0x00) at 0x164e
No dump available for this Super I/O

Probing for Nuvoton Super I/O at 0x2e...
Found Nuvoton NCT6776F/D (C) (id=0xc333) at 0x2e
Register dump:
idx 10 11 13 14 16 17 18 19  1a 1b 1c 1d 1e 1f 20 21  22 23 24 25 26 27 28 2a  2b 2c 2d 2e 2f
val ff ff ff ff ff ff ff ff  c8 68 83 00 ff ff c3 33  ff 00 24 00 00 00 00 00  42 80 00 00 01
def ff ff 00 00 ff ff ff ff  f0 78 00 00 ff ff c3 33  ff 00 64 00 MM 00 00 c0  00 81 00 00 MM
LDN 0x00 (FDC)
idx 30 60 61 70 74 f0 f1 f2  f4 f5
val 00 03 f0 06 02 0e 00 ff  00 00
def 01 03 f0 06 02 0e 00 ff  00 00
LDN 0x01 (Parallel Port)
idx 30 60 61 70 74 f0
val 00 03 78 07 04 3f
def 01 03 78 07 04 3f
LDN 0x02 (UART A)
idx 30 60 61 70 f0 f2
val 01 03 f8 04 00 00
def 01 03 f8 04 00 00
LDN 0x03 (UART B, IR)
idx 30 60 61 70 f0 f1 f2
val 01 02 f8 03 00 00 00
def 01 02 f8 03 00 00 00
LDN 0x05 (Keyboard Controller)
idx 30 60 61 62 63 70 72 f0
val 01 00 60 00 64 01 0c 83
def 00 00 00 00 00 00 00 83
LDN 0x06 (CIR)
idx 30 60 61 70 f0 f1 f2 f3
val 00 00 00 00 08 09 32 00
def 00 00 00 00 08 09 32 00
LDN 0x07 (GPIO6, GPIO7, GPIO8, GPIO9)
idx 30 e0 e1 e2 e3 e4 e5 e6  e7 e8 e9 ea eb ec ed ee  f4 f5 f6 f7 f8
val 00 ff ff ff ff ff ff ff  ff ff ff ff ff ff ff ff  ff ff ff ff ff
def 03 ff 00 00 00 ef 00 00  00 ff 00 00 00 00 00 00  ff 00 00 00 00
LDN 0x08 (WDT1, GPIO0, GPIO1, GPIOA)
idx 30 60 61 e0 e1 e2 e3 e4  f0 f1 f2 f3 f4 f5 f6 f7
val 0a 0a 00 ff f9 00 f9 00  ff ff ff ff ff ff 00 ff
def 02 00 00 ff 00 00 00 00  ff 00 00 00 00 00 00 00
LDN 0x09 (GPIO2, GPIO3, GPIO4, GPIO5)
idx 30 e0 e1 e2 e3 e4 e5 e6  e7 e8 e9 ea eb ee f0 f1  f2 f4 f5 f6 f7 fe
val 0c cf 00 00 00 bd 42 00  00 ff 10 40 ff ff ff ff  ff ff ff ff ff 00
def 04 df 00 00 00 ff 00 00  00 00 00 00 00 00 ff 00  00 ff 00 00 00 00
LDN 0x0a (ACPI)
idx e0 e1 e2 e3 e4 e5 e6 e7  e9 ee f0 f2 f3 f4 f6 f7  fe
val 00 00 00 00 00 02 4c 00  00 00 00 5d 00 00 00 c0  00
def 01 00 00 00 00 02 1c 00  00 00 00 5c 00 00 00 c0  00
LDN 0x0b (Hardware Monitor, Front Panel LED)
idx 30 60 61 62 63 70 e0 e1  e2 f0 f1 f2 f5 f6 f7 f8  f9 fa
val 01 0a 30 00 00 00 7f 7f  ff 00 00 00 10 00 07 40  00 00
def 00 00 00 00 00 00 7f 7f  ff 00 00 00 10 00 87 47  00 00
LDN 0x0d (VID)
idx e0 e1 e2 e3 e4 e5 e6 e9  ee ef f0 f4 f5
val 00 00 00 00 00 00 00 00  88 00 00 00 00
def 00 00 00 00 00 00 00 00  88 00 00 00 00
LDN 0x0e (CIR WAKE-UP)
idx 30 60 61 70
val 00 00 00 00
def 00 00 00 00
LDN 0x0f (GPIO Push-Pull or Open-drain)
idx e0 e1 e2 e3 e4 e5 e6 e7  e8 e9 f0 f1 f2
val ff df ff fe f6 ff ff d3  ff 9f 00 00 00
def ff df ff fe f6 ff ff d3  ff 9f 00 00 00
LDN 0x14 (SVID)
idx e0 e1 e3 e4
val 00 80 00 00
def 00 80 00 00
LDN 0x16 (Deep Sleep)
idx 30 e0 e1 e2
val 00 20 04 05
def 20 20 04 05
LDN 0x17 (GPIOA)
idx e0 e1 e2 e3 e4 e5
val ff ff ff ff 01 ff
def 01 00 00 00 01 00
Bank 0:
    00 01 02 03 04 05 06 07 08 09 0a 0b 0c 0d 0e 0f 
00: 04 92 03 33 00 ff ff ff ff ff ff ff ff ff ff ff 
01: 04 ff 00 92 33 00 ff ff 00 00 00 00 00 83 00 00 
02: 57 e6 cf ce bb a0 b8 1b ff ff ff ba 4b f9 cb e3 
03: b9 e3 b9 ce a9 ac 8d be b1 4b 46 ff ff ff ff ff 
04: 03 00 50 1f ff 00 39 ff 2c ff ff ff 10 05 00 a3 
05: ff ff ff ff ff ff ff ff c1 ff ff ff ff 01 00 ff 
06: 00 ff ff ff ff 01 07 ff ff ff ff ff ff ff ff ff 
07: 00 0a 00 1b 80 14 00 01 80 ff ff ff ff ff ff ff 
08: ff 03 1f 0f ff 3c 3c 3c 00 00 00 00 00 00 00 00 
09: 0a 00 00 00 00 0a 0a 0a 0a aa ef 80 ff 40 46 c4 
0a: 0e 01 00 00 ff 00 00 ff 00 00 80 66 66 06 01 01 
0b: 00 00 00 00 02 01 24 00 1c 00 00 01 66 c0 c4 ff 
0c: 01 00 00 00 00 00 00 00 00 1e 01 ff ff ff ff ff 
0d: ff ff ff ff ff ff ff ff ff ff ff ff ff ff ff ff 
0e: ff ff ff ff ff ff ff ff ff ff ff ff ff ff ff ff 
0f: ff ff ff ff ff ff ff ff ff ff ff ff ff ff ff ff 
Bank 1:
    00 01 02 03 04 05 06 07 08 09 0a 0b 0c 0d 0e 0f 
00: 01 00 40 0a 0a 01 01 3c ff 92 ff ff 00 ff ff ff 
01: ff ff ff ff ff ff ff ff ff ff ff ff ff ff ff ff 
02: 00 19 23 2d 37 ff ff 8c aa c8 e6 ff ff ff ff ff 
03: ff 00 ff ff 00 3c ff ff 00 01 00 00 00 00 00 00 
04: ff ff ff ff ff 5f 12 ff ff ff ff ff ff ff 01 ff 
05: 14 00 00 5c 00 5f 00 ff ff ff ff ff ff ff ff ff 
06: ff ff ff ff ff ff ff ff ff ff ff ff ff ff ff ff 
07: ff ff ff ff ff ff ff ff ff ff ff ff ff ff ff ff 
08: ff ff ff ff ff ff ff ff ff ff ff ff ff ff ff ff 
09: ff ff ff ff ff ff ff ff ff ff ff ff ff ff ff ff 
0a: ff ff ff ff ff ff ff ff ff ff ff ff ff ff ff ff 
0b: ff ff ff ff ff ff ff ff ff ff ff ff ff ff ff ff 
0c: ff ff ff ff ff ff ff ff ff ff ff ff ff ff ff ff 
0d: ff ff ff ff ff ff ff ff ff ff ff ff ff ff ff ff 
0e: ff ff ff ff ff ff ff ff ff ff ff ff ff ff ff ff 
0f: ff ff ff ff ff ff ff ff ff ff ff ff ff ff ff ff 
Bank 2:
    00 01 02 03 04 05 06 07 08 09 0a 0b 0c 0d 0e 0f 
00: 8c 32 45 01 01 33 01 3c ff 33 ff ff 00 ff ff ff 
01: ff ff ff ff ff ff ff ff ff ff ff ff ff ff ff ff 
02: 01 32 5a 5a 5a ff ff 33 ff ff ff ff ff ff ff ff 
03: ff 00 ff ff 00 5f ff ff 03 01 00 00 00 00 00 00 
04: ff ff ff ff ff ef 11 ff ff ff ff ff ff ff 02 ff 
05: 15 80 00 4b 00 50 00 ff ff ff ff ff ff ff ff ff 
06: ff ff ff ff ff ff ff ff ff ff ff ff ff ff ff ff 
07: ff ff ff ff ff ff ff ff ff ff ff ff ff ff ff ff 
08: ff ff ff ff ff ff ff ff ff ff ff ff ff ff ff ff 
09: ff ff ff ff ff ff ff ff ff ff ff ff ff ff ff ff 
0a: ff ff ff ff ff ff ff ff ff ff ff ff ff ff ff ff 
0b: ff ff ff ff ff ff ff ff ff ff ff ff ff ff ff ff 
0c: ff ff ff ff ff ff ff ff ff ff ff ff ff ff ff ff 
0d: ff ff ff ff ff ff ff ff ff ff ff ff ff ff ff ff 
0e: ff ff ff ff ff ff ff ff ff ff ff ff ff ff ff ff 
0f: ff ff ff ff ff ff ff ff ff ff ff ff ff ff ff ff 
Bank 3:
    00 01 02 03 04 05 06 07 08 09 0a 0b 0c 0d 0e 0f 
00: 03 00 00 0a 0a 01 01 3c ff ff ff ff 00 ff ff ff 
01: ff ff ff ff ff ff ff ff ff ff ff ff ff ff ff ff 
02: 00 19 23 2d 37 ff ff 8c aa c8 e6 ff ff ff ff ff 
03: ff 00 ff ff 00 3c ff ff 00 01 00 00 00 00 00 00 
04: ff ff ff ff ff a4 00 ff ff ff ff ff ff ff 03 ff 
05: ff ff ff ff ff ff ff ff ff ff ff ff ff ff ff ff 
06: ff ff ff ff ff ff ff ff ff ff ff ff ff ff ff ff 
07: ff ff ff ff ff ff ff ff ff ff ff ff ff ff ff ff 
08: ff ff ff ff ff ff ff ff ff ff ff ff ff ff ff ff 
09: ff ff ff ff ff ff ff ff ff ff ff ff ff ff ff ff 
0a: ff ff ff ff ff ff ff ff ff ff ff ff ff ff ff ff 
0b: ff ff ff ff ff ff ff ff ff ff ff ff ff ff ff ff 
0c: ff ff ff ff ff ff ff ff ff ff ff ff ff ff ff ff 
0d: ff ff ff ff ff ff ff ff ff ff ff ff ff ff ff ff 
0e: ff ff ff ff ff ff ff ff ff ff ff ff ff ff ff ff 
0f: ff ff ff ff ff ff ff ff ff ff ff ff ff ff ff ff 
Bank 4:
    00 01 02 03 04 05 06 07 08 09 0a 0b 0c 0d 0e 0f 
00: 00 00 00 00 00 00 00 00 00 00 00 00 00 00 00 00 
01: 00 00 00 00 00 00 00 00 00 00 00 ff ff ff ff ff 
02: ff ff ff 96 64 96 64 e1 96 ff ff ff ff ff ff ff 
03: ff ff ff ff ff ff ff ff ff ff ff ff ff ff ff ff 
04: 3f 00 03 ff ff ff ff ff ff ff ff ff ff ff 04 ff 
05: 00 13 ff ff 00 00 00 ff 00 00 08 00 09 ff ff ff 
06: ff 01 00 00 00 00 00 00 ff ff ff ff ff ff ff ff 
07: ff ff ff ff ff ff ff ff ff ff ff ff ff ff ff ff 
08: ff ff ff ff ff ff ff ff ff ff ff ff ff ff ff ff 
09: ff ff ff ff ff ff ff ff ff ff ff ff ff ff ff ff 
0a: ff ff ff ff ff ff ff ff ff ff ff ff ff ff ff ff 
0b: ff ff ff ff ff ff ff ff ff ff ff ff ff ff ff ff 
0c: ff ff ff ff ff ff ff ff ff ff ff ff ff ff ff ff 
0d: ff ff ff ff ff ff ff ff ff ff ff ff ff ff ff ff 
0e: ff ff ff ff ff ff ff ff ff ff ff ff ff ff ff ff 
0f: ff ff ff ff ff ff ff ff ff ff ff ff ff ff ff ff 
Bank 5:
    00 01 02 03 04 05 06 07 08 09 0a 0b 0c 0d 0e 0f 
00: ff ff 00 00 00 00 ff ff ff ff ff ff ff 00 00 ff 
01: ff ff ff ff ff ff ff ff ff ff ff ff ff ff ff ff 
02: ff ff ff ff ff ff ff ff ff ff ff ff ff ff ff ff 
03: ff ff ff ff ff ff ff ff ff ff ff ff ff ff ff ff 
04: ff ff ff ff ff ff ff ff ff ff ff ff ff ff 05 ff 
05: d1 bb 40 ff e3 b9 e3 b9 ff ff ff ff ff ff ff ff 
06: 00 00 00 00 00 00 07 01 01 ff ff ff ff ff ff ff 
07: ff ff ff ff ff ff ff ff ff ff ff ff ff ff ff ff 
08: ff ff ff ff ff ff ff ff ff ff ff ff ff ff ff ff 
09: ff ff ff ff ff ff ff ff ff ff ff ff ff ff ff ff 
0a: ff ff ff ff ff ff ff ff ff ff ff ff ff ff ff ff 
0b: ff ff ff ff ff ff ff ff ff ff ff ff ff ff ff ff 
0c: ff ff ff ff ff ff ff ff ff ff ff ff ff ff ff ff 
0d: ff ff ff ff ff ff ff ff ff ff ff ff ff ff ff ff 
0e: ff ff ff ff ff ff ff ff ff ff ff ff ff ff ff ff 
0f: ff ff ff ff ff ff ff ff ff ff ff ff ff ff ff ff 
Bank 6:
    00 01 02 03 04 05 06 07 08 09 0a 0b 0c 0d 0e 0f 
00: 00 00 ff ff ff ff ff ff ff ff ff ff ff ff ff ff 
01: ff ff ff ff ff ff ff ff ff ff ff ff ff ff ff ff 
02: ff 01 0c 02 01 01 01 ff 00 00 00 1b 1b 1b 07 ff 
03: 08 1f 09 06 ff 1f 08 0e 08 15 8c 06 8c 06 8c 06 
04: 8c 06 8c 06 02 02 02 ff ff ff ff ff ff ff 06 ff 
05: 7f 7f 7f 7f 7f 7f 12 5f 11 ef 00 a4 13 88 13 09 
06: ff ff ff ff ff ff ff ff ff ff ff ff ff ff ff ff 
07: 7f 7f 50 4b 04 7f 7f 50 4b 04 7f 7f 50 4b 04 ff 
08: ff ff ff ff ff ff ff ff ff ff ff ff ff ff ff ff 
09: ff ff ff ff ff ff ff ff ff ff ff ff ff ff ff ff 
0a: ff ff ff ff ff ff ff ff ff ff ff ff ff ff ff ff 
0b: ff ff ff ff ff ff ff ff ff ff ff ff ff ff ff ff 
0c: ff ff ff ff ff ff ff ff ff ff ff ff ff ff ff ff 
0d: ff ff ff ff ff ff ff ff ff ff ff ff ff ff ff ff 
0e: ff ff ff ff ff ff ff ff ff ff ff ff ff ff ff ff 
0f: ff ff ff ff ff ff ff ff ff ff ff ff ff ff ff ff 
Bank 7:
    00 01 02 03 04 05 06 07 08 09 0a 0b 0c 0d 0e 0f 
00: ff 95 02 10 00 00 00 00 00 64 01 00 00 00 00 00 
01: 00 00 00 00 00 00 00 ec 02 f8 80 f8 80 f8 80 01 
02: 14 00 07 00 00 00 ef a0 00 ef 00 00 00 00 00 00 
03: 00 00 00 ff ff ff ff ff ff ff ff ff ff ff ff ff 
04: ff ff ff ff ff ff ff ff ff ff ff ff ff ff 07 ff 
05: ff ff ff ff ff ff ff ff ff ff ff ff ff ff ff ff 
06: ff ff ff ff ff ff ff ff ff ff ff ff ff ff ff ff 
07: ff ff ff ff ff ff ff ff ff ff ff ff ff ff ff ff 
08: ff ff ff ff ff ff ff ff ff ff ff ff ff ff ff ff 
09: ff ff ff ff ff ff ff ff ff ff ff ff ff ff ff ff 
0a: ff ff ff ff ff ff ff ff ff ff ff ff ff ff ff ff 
0b: ff ff ff ff ff ff ff ff ff ff ff ff ff ff ff ff 
0c: ff ff ff ff ff ff ff ff ff ff ff ff ff ff ff ff 
0d: ff ff ff ff ff ff ff ff ff ff ff ff ff ff ff ff 
0e: ff ff ff ff ff ff ff ff ff ff ff ff ff ff ff ff 
0f: ff ff ff ff ff ff ff ff ff ff ff ff ff ff ff ff 
